{
  "version": "cypher-llm-eval-attempts/v1",
  "datasetName": "text2cypher-gpt4o-sample",
  "model": "gpt-4o",
  "attempts": [
    {
      "taskId": "text2cypher-gpt4o-sample-0000-find-the-top-3-users-interacted-with-by-sarahp-b",
      "model": "gpt-4o",
      "rawCypher": "MATCH (u1:User {label: 'sarahp.bsky.social'})-[:INTERACTED]->(u2:User)\nRETURN u2.label AS interactedUser, COUNT(*) AS interactionCount\nORDER BY interactionCount DESC\nLIMIT 3",
      "observed": {
        "syntaxError": false,
        "timeout": false,
        "noCypher": false,
        "returnsResults": true,
        "hasExpectedAnswer": false
      }
    },
    {
      "taskId": "text2cypher-gpt4o-sample-0002-list-the-top-5-users-having-the-most-interaction",
      "model": "gpt-4o",
      "rawCypher": "MATCH (u1:User)-[r:INTERACTED]->(u2:User)\nWHERE r.key = 'specific_key'\nWITH u1, COUNT(r) AS interactions\nORDER BY interactions DESC\nLIMIT 5\nRETURN u1.label AS User, interactions",
      "observed": {
        "syntaxError": false,
        "timeout": false,
        "noCypher": false,
        "returnsResults": false,
        "hasExpectedAnswer": false
      }
    },
    {
      "taskId": "text2cypher-gpt4o-sample-0039-list-all-interactions-with-a-size-less-than-2-be",
      "model": "gpt-4o",
      "timeout": true,
      "observed": {
        "syntaxError": false,
        "timeout": true,
        "noCypher": false,
        "returnsResults": false,
        "hasExpectedAnswer": false
      }
    },
    {
      "taskId": "text2cypher-gpt4o-sample-0168-what-are-the-first-3-questions-with-the-shortest",
      "model": "gpt-4o",
      "rawCypher": "MATCH (q:Question)\nWITH q, length(q.title) AS titleLength\nORDER BY titleLength ASC\nLIMIT 3\nRETURN q.title AS title, q.id AS questionId, titleLength",
      "observed": {
        "syntaxError": true,
        "timeout": false,
        "noCypher": false,
        "returnsResults": false,
        "hasExpectedAnswer": false
      }
    },
    {
      "taskId": "text2cypher-gpt4o-sample-0185-what-are-the-top-5-questions-with-the-most-comme",
      "model": "gpt-4o",
      "noCypher": true,
      "observed": {
        "syntaxError": true,
        "timeout": false,
        "noCypher": true,
        "returnsResults": false,
        "hasExpectedAnswer": false
      }
    }
  ]
}
